{
  "schemaVersion": 1,
  "contractVersion": "1.0.0",
  "messageType": "WINDOW_COMPLETION",
  "eventType": "HARD_BRAKING_EPISODE_V1",
  "eventId": "4cba2d80-c04a-4d24-9f03-f4a85d56da13",
  "unitSystemUid": "demo-unit-validation-001",
  "unitRole": "VALIDATION",
  "serviceVersion": "1.0.0",
  "serviceArtifactSha256": "1111111111111111111111111111111111111111111111111111111111111111",
  "vdpContractVersion": "1.0.0",
  "vdpContractSha256": "2222222222222222222222222222222222222222222222222222222222222222",
  "content": {
    "terminalState": "ABORTED_SERVICE_STOP",
    "reasonCode": "SERVICE_STOP",
    "triggerTimestamp": "2026-08-22T12:00:00.200Z",
    "windowStartTimestamp": "2026-08-22T12:00:00.000Z",
    "windowEndTimestamp": "2026-08-22T12:00:00.200Z",
    "phaseSampleCounts": {
      "PRE": 1,
      "ACTIVE": 1,
      "POST": 0
    },
    "totalSamples": 2,
    "totalChunks": 1,
    "chunkContentSha256": [
      "aab0a76d56fa55c2407fa52e1e84805b739ef0b1d45afc86d9804f60ebb2ab5d"
    ],
    "windowSha256": "fa6d1798446835e3e082ba51ad535f989b703f84645544a18bdc0348df0195bc"
  },
  "contentSha256": "42b0fe6447df1cf72e144b57af316d787dddab4e05579e4811b16f88de299f58"
}
